<Database xmlns:xsi="http://www.w3.org/2001/XMLSchema-instance" xsi:noNamespaceSchemaLocation="../../Schemas/GameDBTreatment.xsd">
    <GameDBTreatment ID="MUT_DBG_TRT_TEST_PROCEDURE">
        <AbbreviationLocID>MUT_DBG_TRT_TEST_PROCEDURE</AbbreviationLocID>
        <DiscomfortLevel>Medium</DiscomfortLevel>
        <Procedure>
            <StaffSelectionRules>REQUIRED_ROOM_OR_DEFAULT_ROOM</StaffSelectionRules>

            <RequiredSkillsToPrescribe>
                <SkillRef>SKILL_DOC_SPEC_GENERAL_SURGERY</SkillRef>
                <SkillRef>SKILL_DOC_SPEC_INTERNAL_MEDICINE</SkillRef>
                <SkillRef>SKILL_DOC_SPEC_CRITICAL_CARE</SkillRef>
            </RequiredSkillsToPrescribe>

            <RequiredDoctorQualificationList>
                <SkillRef>SKILL_DOC_SPEC_GENERAL_SURGERY</SkillRef>
                <SkillRef>SKILL_DOC_SPEC_INTERNAL_MEDICINE</SkillRef>
                <SkillRef>SKILL_DOC_SPEC_CRITICAL_CARE</SkillRef>
            </RequiredDoctorQualificationList>

            <!--RequiredRoomTypeList>
                <RequiredRoomTypeRef>ROOM_TYPE_INTENSIVE_CARE_UNIT</RequiredRoomTypeRef>
                <RequiredRoomTypeRef>ROOM_TYPE_INPATIENT_WARD</RequiredRoomTypeRef>
                <RequiredRoomTypeRef>ROOM_TYPE_HIGH_PRIORITY_INPATIENT_WARD</RequiredRoomTypeRef>
                <RequiredRoomTypeRef>ROOM_TYPE_GENERAL_SURGERY_OFFICE</RequiredRoomTypeRef>
                <RequiredRoomTypeRef>ROOM_TYPE_INPATIENT_GS_OFFICE</RequiredRoomTypeRef>
                <RequiredRoomTypeRef>ROOM_TYPE_INTERNAL_MEDICINE_OFFICE</RequiredRoomTypeRef>
                <RequiredRoomTypeRef>ROOM_TYPE_INPATIENT_IM_OFFICE</RequiredRoomTypeRef>
            </RequiredRoomTypeList-->
            <RequiredRoomTags>
                <Tag>general_surgery_office</Tag>
                <Tag>internal_medicine_office</Tag>
                <Tag>icu</Tag>
                <!-- receipt - automatically done in on-call room for other hospitalizations than observation -->
            </RequiredRoomTags>

            <ProcedureScript>ProjectMutagenesis.DebugScripts.TestProcedure</ProcedureScript>
            <!--TODO tempAnim is anim here needed at all? keep temp for now -->
            <AnimationSetupSitting>
                <AnimationNameIn>stand_press_bandage_hand_in</AnimationNameIn>
                <AnimationNameIdle>stand_press_bandage_hand_idle</AnimationNameIdle>
                <AnimationNameOut>stand_press_bandage_hand_out</AnimationNameOut>
            </AnimationSetupSitting>
            <DressLevel>FULL</DressLevel>
            <DressLevelAfter>FULL</DressLevelAfter>
        </Procedure>
        <TreatmentType>RECEIPT</TreatmentType>
        <ReceiptType>IV_BAG</ReceiptType>
        <IconIndex>1951</IconIndex>
        <DurationHours>0</DurationHours>
        <HospitalizationTreatmentRef>TRT_HOSPITALIZATION_NORMAL</HospitalizationTreatmentRef>
        <AllowedWithAnyHospitalization>true</AllowedWithAnyHospitalization>
    </GameDBTreatment>
</Database>